page	display_pg	col	y_top	height	y_bot	el_idx	kind	frag	n_lines	text	rendered_text
5	1	0	456.46	124.23	332.24	0	sefer_title	full	1	מחיית עמלק - תיקון ל'וקוץ ודרדר תצמיח לך'	מחיית עמלק - תיקון ל'וקוץ ודרדר תצמיח לך'
5	1	0	281.21	44.0	237.21	1	anaf	full	1	ענף א' קליפת עמלק בחטא עץ הדעת	ענף א' קליפת עמלק בחטא עץ הדעת
5	1	1	211.69	40.06	171.63	2	subhead	whole	1	עמלק גרם חטא הראשון של עץ הדעת	עמלק גרם חטא הראשון של עץ הדעת
5	1	1	164.82	136.08	28.74	3	dc1	head	8	הנה	הנה עמלק הוא בחי' ראשית הקיקול והקליפה כמו שנאמר ״ראשית גוים עמלק״, ובוודאי הוא בחי' הנחש שגרם חטא הראשון של חטא עץ הדעת שהוא שורש כל החטאים שבא מכח הקילקול של חטא עץ הדעת, וכן מרומז בהא שדרשו חז״ל
5	1	2	211.69	68.04	143.65	3	body	tail	4	שהמקור להמן שהי' נכדו והמשך	שהמקור להמן שהי' נכדו והמשך של עמלק מרומז החטא עץ הדעת שנא' ״המן״ העץ, ומבואר שעמלק הוא שגרם חטא עץ הדעת.
5	1	2	126.64	40.06	86.58	4	subhead	whole	1	ביאור קללת קוץ ודרדר תצמיח לך	ביאור קללת קוץ ודרדר תצמיח לך
5	1	2	79.77	51.03	28.74	5	dc1	whole	3	וא'	וא' מהקללות שנגרם על ידי חטא עץ הדעת הוא מה שנא' ״קוץ ודרדר תצמיח לך״, וביארו בספה״ק
6	2	1	516.0	289.17	226.83	5	body	whole	17	עומק קללה זו דיש ד' רבתי	עומק קללה זו דיש ד' רבתי בתיבת אחד בהפס' של שמע ישרא' ה' אלקינו ה' אחד וזה לעומת זה יש ר' רבתי בתיבת אחר של הפס' לא תשתחוה לאל אחר, כדי שתהא ברור ולא תהא מקום לטעות בין ה' אחד לאל אחר. ועל ידי חטא עץ הדעת הי' קילקול ונתערב טוב ברע וע״י זה יש מקום לטעות בין הד' של ה' אחד לר' של אל אחר, והוא בחי' הקללה של קוץ ודרדר תצמיח לך כי החילוק של ד' ור' בין בצורת האות ובין בהגימטריא הוא קו״ץ (ר - קו״ץ = ד׳, 200 - 196 = 4), וזהו מרומז בקוץ ודרדר תצמיח לך שהתערב ונפגם הד' עם הר' ע״י נטילת הקוץ.
6	2	1	213.82	40.06	173.76	6	subhead	whole	1	תוספות ביאור החילוק בין ד' לר' שורות ישרות או עקומות	תוספות ביאור החילוק בין ד' לר' שורות ישרות או עקומות
6	2	1	166.95	102.06	64.89	7	dc1	head	6	ויש	ויש להוסיף עוד ביאור כי השי״ת הוא בחי' ישר כמו שנא' להגיד כי ישר ה', וכן כתי' טוב וישר ה', 'וכן התורה הק' נקרא ישר כמו שנא' פיקודי ה' ישרים, משא״כ הרע והקליפה הוא להיפוך עקום
6	2	2	516.0	238.14	277.86	7	body	tail	14	ועקלתון, והפגם של דרדר הוא	ועקלתון, והפגם של דרדר הוא שנפגם ד' הישר של ה' אחד לר' עקומה של אל אחר, וי״ל שהתיקון של הר' שנתהוה ע״י חטא עץ הדעת הוא לסדר האותיות. להפך מהמילוי של אות ריש לישר כי החילוק בין צורת אות ר' לצורת אות ד' שהאות ריש הוא שורות עקומות משא״כ האות ד' הוא שורות ישרות כי הד' שמרמז על השי״ת הוא בחי' ישר משא״כ הר' שמרומז על הרע הוא עקומה וע״י שנעשה מריש ישר נעשה תיקון של ד' שהוא שורות ישרות.
6	2	2	265.61	23.81	241.8	8	subhead	whole	1	מלחמת עמלק על ישראל	מלחמת עמלק על ישראל
6	2	2	234.99	170.1	64.89	9	dc1	whole	10	ולכן	ולכן ישרא' שהם מאמינים בה' אחד נקראים גוי אחד הבחי' של הד' רבתי של ה' אחד, וכמו דאמרינן בתפילה ואל יאבד גוי אחד, המיחדים שמך ה' אלקנו ה' אחד, ונקראים ישרים, ישראל מל' ישר-אל, וכמו שנא' תומת ישרים תנחם וכלל״י הם הבחי' של והאלקים עשה את האדם ישר משא״כ עמלק הוא בחי' ר' רבתי
7	3	1	516.0	85.05	430.95	9	body	whole	5	של אל אחר המתנגד לה' אחד	של אל אחר המתנגד לה' אחד ולכן עמל״ק בגי' א״ל אח״ר וכן ״עמלק״ הוא אותיות ״מעקל״ שהוא בחי' נחש עקלתון, ולכן עמלק מתנגד נגד ישרא' לבטל בחי' ה' אחד.
7	3	1	418.7	23.81	394.89	10	subhead	whole	1	ביאור קללת על גחונך תלך	ביאור קללת על גחונך תלך
7	3	1	388.08	102.06	286.02	11	dc1	whole	6	ולפי	ולפי זה יבואר היטב מה שנענש הנחש שהוא בחי' עמלק שיהיו "על גחונך תלך״ שהרי עי״ז כל גופו נעשה עקומה לבחי' של נחש עקלתון צורה של ר' שאינה שורות ישרות.
7	3	1	273.78	23.81	249.96	12	subhead	whole	1	עמלק בחי' הזבוב שעושה מד' ר'	עמלק בחי' הזבוב שעושה מד' ר'
7	3	1	243.16	187.11	56.05	13	dc1	head	11	ומקור	ומקור לדבר זה שעמלק הוא בחי' חטא עץ הדעת שפגם באות ד' לעשותו ר', מבואר בספר עטרת ישועה (פ' - בשלח), הנה הגמ' סוטה כ' אמר רב יהודה אמר שמוא' משום ר' מאיר כשהייתי למד תורה אצל ר' עקיבא הייתי מטיל קנקנתום לתוך הדיו, ומבאר הגמ' שהיתה מיחש לזבוב דילמא יתיב אתגי' (הקוץ) של דלי״ת ומחוק לי' ומשוי לי' רי״ש ולכן הטיל קנקנתום
7	3	2	516.0	187.11	328.89	13	body	tail	11	שלא יוכל להימחק, ופי' רש״י כגון	שלא יוכל להימחק, ופי' רש״י כגון ד' דאחד דהיינו שיעשה מאחד אחר, ומבאר העטרת ישועה שהזבוב מרמז על עמלק כמבואר בבעל הטורים פ' בשלח שזבו״ב ר״ת ו'שים ז'את ז'כרון ב'ספר ועמלק הוא בחי' הזבוב שרוצה למחוק הקוץ של הד' לעשותו ר' בבחי' קוץ ודרדר, ומבואר שעמלק הוא הפוגם בקוץ ודרדר תצמיח לך בחטא עץ הדעת.
7	3	2	315.24	40.06	275.18	14	subhead	whole	1	ספר תורה של ר״מ במדריגה קודם חטא עץ הדעת	ספר תורה של ר״מ במדריגה קודם חטא עץ הדעת
7	3	2	268.37	136.08	132.29	15	dc1	whole	8	וע״ש	וע״ש בעטרת ישועה שהוסיף עוד, דהי' ספר תורה של ר' מאיר, ור' מאיר הי' תלמוד של אחר, ואחר הוא בחי' ר' רבתי של אל אחר, אבל כחו של ר' מאיר הי' שתוכו אכל וקליפתו זרק ותיקון שתורתו יהי' במדריגת ד' רבתי ולעשות מר' ד' כנ״ל עכת״ד ע״ש.
7	3	2	124.09	68.04	56.05	16	dc1	whole	4	ויש	ויש להוסיף דבאמת מצינו עוד דבר מיוחד בתורתו של ר' מאיר שהי' כתי' שם כתנות אור עם א'. תחת ע' של עור וביארו
8	4	1	514.3	136.08	378.22	16	body	whole	8	בספה״ק שהי' במדריגה של	בספה״ק שהי' במדריגה של תיקון קודם חטא עץ הדעת שלא היצטרכו כתנות עור עם ע' וממש נפלא שדוקא בתורתו הקפיד ג״כ שיהי' תיקון לאות ד' שח״ו לא ימחה להיות ר' בדרגת התיקון על הקוץ ודרדר תצמיח לך.
8	4	1	345.9	34.02	311.88	17	dc1	head	2	ונמצא	ונמצא שספר תורה שלו הי' מיוחד באות א' של אור
8	4	2	516.0	204.12	311.88	17	body	tail	12	וגם מיוחד בד' שלא יהי' ר'	וגם מיוחד בד' שלא יהי' ר' והוא אותיות אדר ונגד ערד מלך עמלק שהוא בחי' ע' והר' קודם הד' וחודש אדר קיבלו התורה מאהבה בפורים, והי' במדריגה של תורה הק' כתיקונם והוא בחי' מחיית עמלק של אדר ופורים ולכן כתי' ליהודים היתה אורה ודרשו חז״ל אורה זו תורה שהיתה תורה בבחי' אור וכמו שנבאר לקמן ב״ה.
9	5	0	498.99	44.0	454.99	18	anaf	full	1	ענף ב' מלחמת עמלק בקריעת ים סוף לבטל קבלת התורה	ענף ב' מלחמת עמלק בקריעת ים סוף לבטל קבלת התורה
9	5	1	429.48	23.81	405.66	19	subhead	whole	1	האבות במדריגה ישרים	האבות במדריגה ישרים
9	5	1	398.86	323.19	75.67	20	dc1	whole	19	והנה	והנה עמלק גרם לעוות היושר והאמונה בה' אחד וגרם קלקול בכל העולם בבחי' קוץ ודרדר תצמיח לך וכמו שביארנו לעיל, אבל האבות הם היו בבחי' תיקון העולם, וגילוי אמונת ה' בעולם ורק התולדות של האבות בני יעקב אבינו הוצטרכו לילך ולהזדכך בכור הברזל של גלות מצרים ולתקן חטא אדם הראשון עד שיזכו לתעבדון את האלקים על ההר הזה בבחי' פסקה זוהמתן של הנחש בחטא עץ הדעת, ולכן ספר בראשי״ת שהוא בחי' ספר האבות הוא האותיות יש״ר אב״ת שהאבות היו בבחי' ישרים (וספר בראשית נקרא ספר הישר) שהאבות גילוי בחי' ה' אחד בחי' ישר מריש כמבואר לעיל.
9	5	2	429.48	40.06	389.41	21	subhead	whole	1	מעלת יציאת מצרים וקריעת ים סוף לגלות ד' רבתי של ה' אחד	מעלת יציאת מצרים וקריעת ים סוף לגלות ד' רבתי של ה' אחד
9	5	2	382.61	255.15	127.46	22	dc1	whole	15	אבל	אבל זה הי' רק מדריגת האבות אבל כלל ישרא' הלכו במצרים להזדכך עד שיגיעו למתן תורה ולכן בהתחלת גלות מצרים כתי' ויקצו מפני בני ישרא' דהיינו שהמצרים רצו להפסיד בחי' תיקון הקוץ של ה' אחד הקוץ ודרדר תמציח לך ולאחר כל השיעבוד והעשר מכות ויציאת מצרים כתי' ובני ישרא' יוצאים ביד רמה ופי' התרגום בריש גלי וי״ל הפי' שנתגלה האפסיות והשקר של הריש האות ר' רבתי של אל אחר ונשתנה לישר ושורות ישרות של ד' לגילוי ה' אחד.
9	5	2	124.46	51.03	73.43	23	dc1	whole	3	וביותר	וביותר נתגלה דבר זה בשעת קריעת ים סוף שהרי אז כבר נאמר ויאמינו בה' ובמשה
10	6	1	516.0	102.06	413.94	23	body	whole	6	עבדו, שזכו להאמין ולגלות הד'	עבדו, שזכו להאמין ולגלות הד' רבתי של ה' אחד ולכן הסוף של שירת הים שהוא בחי' התכלית הוא אות ד' של ה' ימלוך לעולם ועד שנתגלה בחי' ד' רבתי של ה' אחד ונתגלה מלכות ה' בכל העולם.
10	6	1	407.14	255.15	151.99	24	dc1	whole	15	וכן	וכן יש נוהגין בתפילת שחרית לאחר שירת הים לומר ובתורתך כתוב לאמר שמע ישרא' ה' אלקנו ה' אחד כי בשעת קריעת ים סוף נתגלה הד' רבתי כנ״ל, וגם אומרים הפס' של והיה ה' למלך וגו', ה' אחד ושמו אחד ועוד י״ל שלכן מתחיל השירה באז ישיר, ישי״ר הוא בחי' ישר שנעשה מריש יש״ר שיהי' שורות שוות כמו ד' וכן א״ז בגי' ב' פעמים ״ד' בחי' דרדר, וביותר מרומז בהא די״ם סו״ף בגי' קו״ץ, וקריעת ים סוף היינו שנקרע מספר י״ם סו״ף קו״ץ מר' שהוא מספר ד' שנתגלה הד' של ה' אחד.
10	6	1	139.74	40.06	99.67	25	subhead	whole	1	עמלק בא לבטל גילוי ה' אחד של קריעת ים סוף	עמלק בא לבטל גילוי ה' אחד של קריעת ים סוף
10	6	1	92.87	34.02	58.85	26	dc1	head	2	ולפי	ולפי המבואר לעיל מובן למה דוקא כאן בא עמלק להילחם
10	6	2	516.0	102.06	413.94	26	body	tail	6	עם ישרא' כי עמל״ק שהוא בגי'	עם ישרא' כי עמל״ק שהוא בגי' א״ל אח״ר בחי' ר' רבתי אינו יכול לסבול הגילוי של הישרות של ה' אחד שנתגלה בקריעת י״ם סו״ף שהוא בחי' הקו״ץ של הד' כמו שנתבאר לעיל.
10	6	2	403.73	68.04	335.69	27	dc1	whole	4	ובזה	ובזה ימתק מה שנא' בעמלק מלחמה לה' בעמלק מדרד״ר שהם אותיות דרדר לתקן מה שהחליש וקרר הגילוי של ה' אחד.
10	6	2	325.49	85.05	240.44	28	dc1	whole	5	ועוד	ועוד יובן מה שאיתא במדרש שעמלק בא מהלך של ת' פרסה וי״ל שמרומז בת' שהוא בגי' קו״ץ ד״ר שבא להילחם בתיקון הקו״ץ של ה' אחד.
10	6	2	224.79	40.06	184.72	29	subhead	whole	1	מלחמת עמלק פגם בקבלת התורה של נעשה ונשמע	מלחמת עמלק פגם בקבלת התורה של נעשה ונשמע
10	6	2	177.92	119.07	58.85	30	dc1	whole	7	וביותר	וביותר עומק י״ל כי ע״י הגילוי של קריעת ים סוף זכו לקבלת התורה בשלימות ולמדריגת נעשה ונשמע, כי התורה הוא בחי' של פיקודי ה' ישרים משמחי לב, וכן כתי' ישרים דרכי ה' צדיקים ילכו בם וע״י התיקון של ישר
11	7	1	516.0	238.14	277.86	30	body	whole	14	ותיקון של ה' אחד של קריעת	ותיקון של ה' אחד של קריעת ים סוף זכו לקבלת התורה, וכן מדריגת נעשה ונשמע הוא מדריגת ישרים כמבואר במסכת שבת פ״ח במעשה דהדדוקי שאמר לרבא שכלל ישרא' הם עמא פזיזא שקיבלו נעשה קודם לנשמע וא״ל שאצל כלל ישרא' כתי' תומת ישרים תנחם ע״ש, ואז הי' זמן של תיקון חטא עץ הדעת כי המדריגה של ישרים מחייב קבלת התורה מאהבה ושמחה כי הוא מדריגה של ישרים, משמחי לב ומקבל התורה בשלימות.
11	7	1	267.01	85.05	181.96	31	dc1	whole	5	ועמלק	ועמלק רצה לבטל מדריגת הישר ולכן בא לאחר קריעת ים סוף לבטל מדריגת הישר של כלל ישרא' ולבטל מדריגה נעשה ונשמע שבא מכח מדריגת ישרים.
11	7	1	171.12	102.06	69.06	32	dc1	whole	6	ויש	ויש לומר רמז נפלא שלכן כתי' זכור את אשר עשה לך עמלק בדרך עש״ה ל״ך בגי' נעש״ה עמל״ק בדר"ך בג' ונשמ״ע. שעמלק בא לבטל מדריגה זו של כלל ישרא' שבא מכח מדת הישר.
11	7	2	516.0	23.81	492.19	33	subhead	whole	1	עמלק גרם חטא העגל	עמלק גרם חטא העגל
11	7	2	485.38	255.15	230.23	34	dc1	whole	15	ואע״פ	ואע״פ שכלל ישרא' קיבלו התורה בנעשה ונשמע מלחמת עמלק גרם שלא יהי' בשלימות וע״י זה נגרם חטא העגל שהוא בחי' א״ל אח״ר שבגימטריא עמל״ק, וכן עמל״ק שבא ביום המ' ליציאת מצרים הוא אותיות עגל מ' כי אות ק' ואות ג' מתחלפין, ולכן כתי' לך רד כי שחת עמך כי על ידי חטא העגל חזרה זוהמת הנחש ונשאר הבילבול של קוץ ודרדר תצמיח לך, וכל זה ע״י מלחמת עמלק בין קריעת ים סוף למתן תורה שהוא מנגד לתיקון של ה' אחד.
11	7	2	217.98	40.06	177.92	35	subhead	whole	1	משה רבינו לא משתייך לחטא העגל	משה רבינו לא משתייך לחטא העגל
11	7	2	171.12	102.06	69.06	36	dc1	whole	6	ואע״פ	ואע״פ שלכלל ישרא' הי' פגם של חטא העגל בחי' ר' של אל אחר משה רבינו לא נפגם כלל בחטא העגל כמו שביארו בספה״ק הא דנתגלה טעמו של פרה אדומה רק למשה רבינו שהרי הפרה
12	8	1	512.34	221.13	291.21	36	body	whole	13	אדומה הי' משתייך לכפרת חטא	אדומה הי' משתייך לכפרת חטא העגל ורק משה רבינו שלא הי' בכלל בעולם הזה בשעת החטא ולא הי' משתייך לזה כלל זכה להשיג טעם הפרה אדומה, ולכן משה רבינו הוא בחי' התיקון של ד' רבתי משא״כ כלל ישרא' שנפגמו קצת בחטא העגל ולכן החילוק של הגימטריא בין מש״ה לישרא״ל הוא כמנין קו״ץ (י״ם סו״ף) שמשה רבינו זכה שישאר אצלו אותו גילוי של ה' אחד של קריעת ים סוף ומתן תורה.
12	8	1	258.89	204.12	54.77	37	dc1	whole	12	וגם	וגם כתי' במשה רבינו שקרן עור פניו והוא בחי' כתנות אור עם א' של תיקון חטא עץ הדעת וכלל״י אבדו מדריגה זו בחטא העגל אבל משה זכה שישאר אצלו וכתי' ויתן על פניו מסוה הוא הס״ת של סוס ורוכבו רמה בים שהיא עיקר השירה שנאמרה בתורה בין באנשים בין בנשים, שהסתיר המדריגה של תיקון חטא עץ הדעת שזכו בשעת קריעת ים סוף ומתן תורה.
12	8	2	516.0	40.06	475.94	38	subhead	whole	1	מחיית עמלק ע״י אמן יהא שמי' רבא	מחיית עמלק ע״י אמן יהא שמי' רבא
12	8	2	469.13	170.1	299.03	39	dc1	whole	10	ויש	ויש להוסיף עוד, שהרי אמרו חז״ל אין השם שלם וכסא שלם עד שימחה זרעו של עמלק, ולכן מתפללין בקדיש יהא שמי' רבא שיגדל שמו של הקב״ה במחיית עמלק, ואז יהי' תיקון של ה' אחד ושורות ישרות של ד' ולכן הר״ת של יהא שמי' רבא הוא ישר שבמחיית עמלק יהיו במדריגת ישרים.
12	8	2	289.51	23.81	265.69	40	subhead	whole	1	ערד מלך עמלק	ערד מלך עמלק
12	8	2	258.89	204.12	54.77	41	dc1	whole	12	ובאמת	ובאמת מצינו עוד פעם שבא עמלק להילחם עם ישרא' בתורה בפ' חקת וישמע הכנעני מלך ערד יושב הנגב וגו'. ופירש״י ששמע שמת אהרן, וי״ל שערד יש בו אותיות ר״ד שבא להמשיך קליפת עמלק לבטל הקוץ של ה' אחד לאל אחר וער״ד בגי' מרדכ״י וכמו שנבאר לקמן (ענף ד') שמרדכי הוא בחי' התיקון של הד' נגד קליפת ערד וחודש אדר הוא כנגד ערד כי ע' וא' מתחלפין ויש באדר
13	9	1	516.0	51.03	464.97	41	body	whole	3	ג״כ התיקון של ר' ד' כמו	ג״כ התיקון של ר' ד' כמו שיתבאר לקמן (ענף ה'), וגם כתי' וידר נדר מל' תיקון של ד' ר'.
13	9	1	444.56	23.81	420.74	42	subhead	whole	1	נחש הנחושת	נחש הנחושת
13	9	1	413.94	102.06	311.88	43	dc1	head	6	ומיד	ומיד לאחר שבא ערד מלך עמלק כתי' וידבר העם באלקים ובמשה והתלוננו על המן ובא נחשים ושרפים, ולפי הנ״ל י״ל שערד מלך עמלק עשה פגם במדריגה של קבלת
13	9	2	516.0	204.12	311.88	43	body	tail	12	התורה שהרי לא ניתנה תורה	התורה שהרי לא ניתנה תורה אלא לאוכלי המן, וכמו שביארנו לעיל שעמלק מבטל הקבלת התורה בדרגה של ישרים ולכן בא עונש של נחש שהי' בחי' חטא עץ הדעת שגם כן הי' פגם בבחי' ד' הישר, ולכן אמר לו השי״ת למשה עשה לך שרף, ושים אותו על הנס שהוא בח' עץ ישר, לעשות מנחש העקלתון ר' עקומה בחי' ישר של ד'.
14	10	0	498.99	44.0	454.99	44	anaf	full	1	ענף ג' מלחמת עמלק בימי שמוא' ושאול ואגג	ענף ג' מלחמת עמלק בימי שמוא' ושאול ואגג
14	10	1	429.48	289.17	140.31	45	dc1	whole	17	והנה	והנה מלחמת עמלק נמשך בכל הדורות ובזמן שאול המלך היתה עוד התעוררות למחיית עמלק והוא ההפטורה לשבת זכור, ולבסוף כתי' שם ״וישסף שמוא' את אגג לפני ה'״ שהרג שמוא' המלך של עמלק בזמן ההוא, אבל לא כתי' שהרגו סתם רק כתי' וישסף ופירש רש״י וישסף - ״חתכו לארבע״, ואין לתיבה זו דמיון, וצ״ב למה הורגו דוקא במיתה זו שחתכו לד' חלקים, ועוד צ״ב מהו המקור לרש״י שזהו הפי' של וישסף [ובפשטות מביא שם רש״י מהתרגום שהוא ל' בקיעה ורש״י הבין שהבקיעה של אדם הוא ע״י שיחתכו לארבע חלקים].
14	10	2	429.48	289.17	140.31	46	dc1	whole	17	אבל	אבל לפי מה שביארנו לעיל שהקליפה של עמלק הוא להכחיש הד' רבתי של ה' אחד של שורות ישרות ולעורר הר' רבתי של אל אחר מובן היטיב למה המחיית עמלק של שמוא' הי' דוקא שיעשה מאגג ד' חלקים שרצה לתקן הד' רבתי של ה' אחד וי״ל רמז נפלא שמרומז כן בהפס' דכתי' וישסף שמוא' א״ת אג״ג לפנ״י ה״י, א״ת אג״ג בגמטריא דרד״ר, לפנ״י הי' בגימטריא קו״ץ כלומר שעל ידי שחותכו לד' רצה לתקן הקוץ ודרדר שיהי' ד' רבתי של ה' אחד (וגם חתכ״ו בגי' דל״ת חתכ״ו לד' היינו ב' פעמים ד' של דרדר).
15	11	0	498.99	44.0	454.99	47	anaf	full	1	ענף ד' מלחמת עמלק בימי מרדכי ואסתר והמן	ענף ד' מלחמת עמלק בימי מרדכי ואסתר והמן
15	11	1	429.48	23.81	405.66	48	subhead	whole	1	המן מתנגד לתיקון הקוץ של הד'	המן מתנגד לתיקון הקוץ של הד'
15	11	1	398.86	340.2	58.66	49	dc1	head	20	ובימי	ובימי אחשורוש הי' עוד זמן שהתעורר קליפת עמלק על ידי המן, והמן הי' בחי' של עבודה זרה, הר' רבתי של ״אל אחר״ שבגי' עמל״ק כמבואר לעיל, ולכן כל אחד ואחד הי' צריך להשתחוות להמן, בבחי' לא תשתחווה לאל אחר, [וגם הקיטרוג של אותו דור היתה שהשתחוו לצלם] והמן לא הי' סובל הד' רבתי של ה' אחד ולכן התנגד לישנו עם אחד היינו כלל ישרא' שמכריזים הד' רבתי של ה' אחד, ועוד איתא במדרש על והנה המן עומד בחצר שבא דוקא בזמן שאין אומרים קרי״ש (באמצע הלילה). והמ״ן במילוי כזה ה״ה מ״ם נו״ן בגימטריא קו״ץ שהתנגד לתיקון של הקו״ץ ודרדר תצמיח לך ובאמת מצינו בחז״ל שהעץ שעליו נתלה המן הי' ״קוץ״,
15	11	2	429.48	170.1	259.38	49	body	tail	10	עיין מדרש רבה ('(ט״ב)', '1carizma', 11.475) אמרו חכמים	עיין מדרש רבה (ט״ב) אמרו חכמים בשעה שבא להכינו קרא הקב״ה לכל עצי בראשית מי יתן עצמו ויתלה רשע זה עליו ע״ש שבא כל מיני עצים עד שבא קוץ וכו', שאני קוץ והוא קוץ מכאיב, ונאה שיתלה קוץ על קוץ. ולפי דברינו מובן היטב שזה הי' קליפת המן ועמלק ועליו נתלה לגלות ולתקן הד' רבתי של ה' אחד.
15	11	2	241.61	40.06	201.54	50	subhead	whole	1	המן מתנגד להגילוי של קריעת ים סוף	המן מתנגד להגילוי של קריעת ים סוף
15	11	2	194.74	136.08	58.66	51	dc1	whole	8	ועוד	ועוד יש לרמז דהמן מתנגד לגילוי של קריעת ים סוף דכתי' אמר אויב ארדף אשיג אחלל שלל, אויב מרמז להמן דכתי' איש צר ואויב, אחלק שלל, הוא נגד מה שכתוב בתורה, בנימין זאב יטרוף בבוקר יאכל עד ולערב יחלק שלל ופירש״י דקאי על זמן מרדכי והמן
16	12	1	516.0	187.11	328.89	51	body	whole	11	שנטל מרדכי ביתו של המן, ועוד	שנטל מרדכי ביתו של המן, ועוד י״ל רמז נפלא, דיש נ״ד פעמים המ״ן במגילה והוא בגי' חמשת אלפים ק״ל והוא מרומז באחל״ק שהוא ר״ת חמשת אלפים ק"ל ובחי' השלל מרמז על הגילוי של ה' אחד, שכן אוי״ב ארד״ף אשי״ג אחל״ק של״ל בגי' שמ״ע ישרא' ה' אלקנו ה' אח״ד (ועם אמ״ר אויב בגי' ברו״ך ש״ם כבו״ד מלכות״ו לעול״ם וע״ד).
