page	display_pg	col	y_top	height	y_bot	el_idx	kind	frag	n_lines	text	rendered_text
16	12	1	322.09	153.09	169.0	52	dc1	whole	9	[ועוד	[ועוד מצינו אצל סעודת אחשורוש היתה ודר וסוחרת ועיין בגמ' מגילה דרי דרי ופי' רש״י שורות שורות סביב, וסוחרת מל' סחור סחור ואולי י״ל שעשו משורות ישרות שלא יהיו ישרות רק סביב ועקום והוא הבחינה לעשות מד' ר' כמבואר לעיל].
16	12	1	156.75	40.06	116.68	53	subhead	whole	1	הגילוי של קריעת ים סוף בימי מרדכי ואסתר	הגילוי של קריעת ים סוף בימי מרדכי ואסתר
16	12	1	109.88	51.03	58.85	54	dc1	head	3	הנה	הנה בכל המגילה כתי' פרס קודם מדי ורק בסוף המגילה כתי' מדי קודם פרס, ולפי דרכנו
16	12	2	516.0	136.08	379.92	54	body	tail	8	י״ל הפשט שבתחילת המגילה	י״ל הפשט שבתחילת המגילה כשהיתה התעוררות הר' של אל אחר דהמן כתי' פרס קודם מדי שהאות האמצעי' של שניהם הוא ר' ד' והר' קודם הד' אבל לבסוף המגילה שהי' מחיית עמלק כתי' מדי קודם פרס שהד' קודם הר' באותיות האמצעיות.
16	12	2	372.48	85.05	287.43	55	dc1	whole	5	ובאמת	ובאמת מרומז יותר מזה שהרי האותיות החיצוניות של פרס ומדי שאינם ר' ד' הם בגי' קו״ץ לרמז על הקוץ של הד' שיש יותר מהר'.
16	12	2	279.98	221.13	58.85	56	dc1	whole	13	ועוד	ועוד יותר יש לרמז שהר' ביארנו שהגילוי של ה' אחד היה בשעת קריעת ים סוף שנקרע ונתגלה הקו״ץ של הד' שבג' י״ד סו״ף וממש נפלא שהאותיות החיצוניות של ״פרס ומדי״ הוא ממש אותיות ״ים סוף״ והאמצעי הוא אותיות ר' ד' וכשנקרע ים סוף נתגלה הד' על הר' והוא בחי' האמצעי של ים סוף שמרומז בהאמצעי של פרס ומדי, והוא כמבואר לעיל שבתחילה הי' הסתר על הגילוי של הקריעת ים סוף
17	13	1	516.0	119.07	396.93	56	body	whole	7	ולכן הר' קודם הד' בתוך פרס	ולכן הר' קודם הד' בתוך פרס ומדי המרמז לקריעת ים סוף אבל לבסוף המגילה כתי' מדי קודם פרס שחזר ונתגלה הד' קודם הר' בחי' קריעת ים סוף של פרס ומדי ע״י שנתלה המן והיו מחיית עמלק לתקן הקוץ של הד' של ה' אחד והוא נפלא.
17	13	1	391.57	119.07	272.5	57	dc1	whole	7	ועוד	ועוד פרס ומדי ממש מרומז בקריעת ים סוף עצמו שהרי בשירה כתי' תפול עליהם אימתה ופחד בגדול זרעך ידמו כאבן גדו״ל זרוע״ך בגי' פר״ס ידמ״ו אותיות ומדי ובתוכם מרומז הגילוי של קריעת ים סוף כנ״ל.
17	13	1	267.15	119.07	148.08	58	dc1	whole	7	[ובאמת	[ובאמת עיין במדרש רבה בפס' חיל פרס ומדי שמדי מל' מודיא להקב״ה בחי' אמונה. ואע״פ שיש בהם עבודה זרה היתה זו רק מסורת אבותיהם ומתאים מאוד עם הנ״ל שמדי מרמז על הקדושה והתיקון של ה' אחד].
17	13	1	137.28	40.06	97.21	59	subhead	whole	1	מרדכי בחי' התיקון של קוץ ודרדר	מרדכי בחי' התיקון של קוץ ודרדר
17	13	1	90.41	34.02	56.39	60	dc1	head	2	וכל	וכל זה בא על ידי מרדכי הצדיק, ומרדכי לא יכרע ולא
17	13	2	516.0	221.13	294.87	60	body	tail	13	ישתחווה שהי' תמיד בבחינת ד'	ישתחווה שהי' תמיד בבחינת ד' של ה' אחד, ומרדכי הוא אותיות דרך י״ם, בחי' קריעת ים סו״ף שהיתה תמיד בבחי' גילוי הקו״ץ, שנתגלה שם, וגם מרד ממרדכי מרמז לעשות מר' ד', ומרדכ״י בגי' רע״ד נגד ער״ד מלך עמלק שרצה לבטל התיקון של ר' ד', וגם מרדכי נקרא צדיק צדי״ק בג' ר״ד שתיקון הקוץ ודרדר תצמיח לך וגם המשיך הגילוי של קריעת ים סוף דכתי' שם אילו מואב אחזימו רע״ד שבגי' מרדכ"י.
17	13	2	257.11	23.81	233.29	61	subhead	whole	1	מגילה כאגרת	מגילה כאגרת
17	13	2	226.49	170.1	56.39	62	dc1	whole	10	ולפי	ולפי זה י״ל בדרך רמז, מה שהמגילה נקרא אגר״ת, כי אגר״ת בגי' קו״ץ דרד״ר, כי על ידי מקרא מגילה זוכין להתגלות של אחד, ולתקן הקוץ ודרדר תצמיח לך, וגם הצורה הוא כולו עקומה כמו נחש וע"י הקריאה מפשיט העקמימות לישר והוי תיקון לבחי' הר' שהוא שורות עקומות שאינן ישרות להפוך אותו לד'.
18	14	1	516.0	23.81	492.19	63	subhead	whole	1	מנהג גראגע״ר	מנהג גראגע״ר
18	14	1	485.38	136.08	349.3	64	dc1	whole	8	והוסיף	והוסיף תלמיד, לפי זה נפלא ממש למה כשמזכירין שמו של המן במגילה יש ענין לעורר רעש ע״י גראגע״ר, כי גראגע״ר הוא צורה של ד תיקון הקו״ץ של הר', וכדי למחות המן ועמלק מעוררים הד' בקול גדול (וגם גראגא״ר בגי' דרד"ר).
18	14	1	335.01	23.81	311.2	65	subhead	whole	1	שיכרות בפורים	שיכרות בפורים
18	14	1	304.4	238.14	66.26	66	dc1	head	14	ולפי	ולפי מה שיבואר לעיל יש לבאר גם הא ששותים יין ומשתכרים בפורים, שהרי החטא עץ הדעת שי' ר' מאיר הוא שהיתה גפן, וע״י שעמלק גרם החטא נתערב טוב ברע שיהי' קוץ ודרדר תצמיח לך, והוא בחי' של שורות עקומות שאינן ישרות, בחי' שיכור שאינו יכול לילך בדרך ישר, והתיקון הוא לגלות בתוך העקמומיות ה' אחד ולעשות מריש ישר, וי״ל רמז נפלא שיכו״ר אותיות יש״ר כ״ו היינו להגיד כי יש״ר ה'״ צורי ולא ״עולתה״ בו
18	14	2	516.0	51.03	464.97	66	body	tail	3	שאין שום עקומיות ומתקנין	שאין שום עקומיות ומתקנין התיקון של קוץ ודרדר תצמיח לך, וזוכין לדעת כי טוב וישר ה'.
18	14	2	452.72	23.81	428.91	67	subhead	whole	1	קבלת התורה מאהבה בפורים	קבלת התורה מאהבה בפורים
18	14	2	422.1	170.1	252.0	68	dc1	whole	10	וע״י	וע״י שזכו למדריגה של ישר ה', ולתיקון הד' של שורות ישרות, קיבלו התורה מאהבה הבחי' של משפטי ה' ישרים משמחי לב, והי' תיקון על קליפת עמלק שרצה לבטל הקבלת התורה והנעשה ונשמע כמו שביארנו לעיל, וכתי' אורה זו תורה שזכו במדריגת התורה בבחי' כותנות אור עם א' חטא עץ הדעת.
18	14	2	245.2	51.03	194.17	69	dc1	whole	3	ולכן	ולכן לובשין מסוה בפורים כמו אצל משה רבינו בקרן עור פניו בחי' של קודם חטא עץ הדעת.
18	14	2	181.92	23.81	158.11	70	subhead	whole	1	מספר הרוגים בשושן הבירה	מספר הרוגים בשושן הבירה
18	14	2	151.31	85.05	66.26	71	dc1	whole	5	ועוד	ועוד יש לרמז, דכתי' ובשושן הבירה הרגו היהודים ואבד חמש מאות איש, ואת פרשנדתא וגו', כל העשרת בני המן, דהיינו שהרגו תק״י אנשים, וצ״ב למה
19	15	1	516.0	34.02	481.98	71	body	head	2	דוקא מספר זה, ולהנ״ל י״ל שמרמז	דוקא מספר זה, ולהנ״ל י״ל שמרמז שתיקנו מדריגת יש״ר שהוא בגי'
19	15	2	516.0	34.02	481.98	71	body	tail	2	תק״י, נגד י' בני המן ועוד	תק״י, נגד י' בני המן ועוד ״ש״ר נגד שאר אנשי שושן.
20	16	0	498.99	44.0	454.99	72	anaf	full	1	ענף ה' משנכנס אדר מרבין בשמחה	ענף ה' משנכנס אדר מרבין בשמחה
20	16	1	429.48	23.81	405.66	73	subhead	whole	1	למה דוקא באדר מרבין בשמחה	למה דוקא באדר מרבין בשמחה
20	16	1	398.86	85.05	313.81	74	dc1	whole	5	איתא	איתא בחז״ל (סוף מסכת תענית) אמר רב יהודה ברי' דרב שמוא' בר שילת כשם שמשנכנס אב ממעטין בשמחה כך משנכנס אדר מרבין בשמחה.
20	16	1	307.0	51.03	255.97	75	dc1	whole	3	ויל״ע	ויל״ע למה דוקא בנס של פורים מרבין בשמחה, ועוד יל״ע מהו המשמעות של תיבת אדר.
20	16	1	249.17	187.11	62.06	76	dc1	head	11	ולפי	ולפי המבואר לעיל שעיקר התיקון והמחי' של עמלק הוא לגלות הד' על הר', ולגלות ה' אחד, מובן שאדר נקרא א' ע״ש אלופו של עולם וד״ר״ שהתגבר ונתקן הד' על הר' (ובהמשך יתבאר עוד ביאור בהא'), ולפי״ז מובן ג״כ למה דוקא מרבין בשמחה, שהרי ביארנו לעיל שהתיקון של ד' הוא ע״י שורות ישרות בחינה של ישר, וזהו שמביא 'לידי שמחה כמו שנא'
20	16	2	429.48	85.05	344.43	76	body	tail	5	ולישרי לב שמחה, ועוד נאמר	ולישרי לב שמחה, ועוד נאמר פיקודי ה' ישרים משמחי לב, ולכן החודש שיש תיקון של ד'ר', התיקון של ישרות, מיוחד לשמחה יתירה.
20	16	2	330.06	40.06	289.99	77	subhead	whole	1	ביאור בשם בעל המימרא רב שמוא' בר שילת	ביאור בשם בעל המימרא רב שמוא' בר שילת
20	16	2	283.19	221.13	62.06	78	dc1	whole	13	והנה	והנה איתא בספה״ק שרב שמוא' בר שילת הי' מבני בניו של המן שלמדו תורה בבני ברק, והוא בעל המימרא של משנכנס אדר מרבין בשמחה, ובספה״ק מבארים שם שיל״ת בכמה אופנים ולפי דרכנו יש לומר שהתיקון של אדר הוא הד' על הר' והמילוי של ר' הוא ״שי״, והמלוי של ד' הוא ״לת״ וביחד הוא שילת, דהיינו שהוא תולדה מהמן ותיקון הקוץ ודרדר הד' על הר', ודוקא הוא הבעל מימרא של חודש אד״ר״ שהוא
21	17	1	516.0	68.04	447.96	78	body	whole	4	התיקון על ד' ר' ('(משנכנס', '1carizma', 11.475) ('אדר', '1carizma', 11.475)	התיקון על ד' ר' (משנכנס אדר היינו התוך והפנימיות של אדר הוא המילוי בחי' שילת כנ״ל מרבין בשמחה הבחי' של ולישרי לב שמחה כנ״ל).
21	17	1	411.6	23.81	387.78	79	subhead	whole	1	השפעת משה רבינו בחודש אדר	השפעת משה רבינו בחודש אדר
21	17	1	380.98	170.1	210.88	80	dc1	whole	10	הנה	הנה בחז"ל מבואר שזכותו של משה רבינו שנולד בחודש אדר הי׳ סיבה לנס של פורים ולפי המבואר לעיל (ענף ב׳) שמשה רבינו היה במדריגת תיקון הקוץ של קריעת ים סוף שלא אבדו בחטא העגל ולכן החילוק בין משה לישרא׳ הוא קו"ץ (ים סו"ף) מובן שמשתייך לחודש אדר שמקרי ע"ש התיקון של ד"ר.
21	17	1	174.52	23.81	150.7	81	subhead	whole	1	חודש אדר נרמז בקריעת ים סוף	חודש אדר נרמז בקריעת ים סוף
21	17	1	143.9	68.04	75.86	82	dc1	head	4	וגם	וגם חודש אדר מרומז בהגילוי והשירה של קריעת ים סוף, א' - כתי' ימינך ה' נ"אדר"י בכח, ב' - מי כמוכה באלים ה' ומי כמוך
21	17	2	516.0	34.02	481.98	82	body	tail	2	"נאדר" בקודש, שיש בה הארה	"נאדר" בקודש, שיש בה הארה מאותו גילוי של הד' רבתי.
21	17	2	475.18	119.07	356.11	83	dc1	whole	7	ועוד	ועוד דמזל אדר דגים המקום של דגים הוא בתוך הפנימיות של ים סוף בחי' של קריעת ים סוף, וגם משה רבינו שמרמז על דרגת קריעת ים סוף, נקרא ע״ש כי מן המים משיתיהו כבחי' דגים של חודש אדר.
21	17	2	343.86	40.06	303.79	84	subhead	whole	1	חודש אדר בחי' התיקון של ספר תורה דר״מ	חודש אדר בחי' התיקון של ספר תורה דר״מ
21	17	2	296.99	221.13	75.86	85	dc1	whole	13	ועיין	ועיין לעיל (ענף א) שביארנו ע״פ דברי העטרת ישועה שספר תורה של ר' מאיר הי' מיוחד בא' של כתנות אור, וגם הקפיד על הד' שלא יתהפך לר', ונמצא מיוחד בבחי' א-דר, בחי' התיקון של קודם חטא עץ הדעת, והוא נגד ערד מלך עמלק שהי' בחי' כתנות עור עם ע' והר' קודם הד' ע״ש, הרי שחודש אדר מסוגל לתיקון הקוץ של הד' רבתי של ה' אחד ולתיקון של כתנות אור כמו קודם חטא עץ הדעת.
22	18	0	498.99	44.0	454.99	86	anaf	full	1	ענף ו' גילוי ה' אחד ביציאת מצרים ובליל הסדר	ענף ו' גילוי ה' אחד ביציאת מצרים ובליל הסדר
22	18	1	429.48	23.81	405.66	87	subhead	whole	1	פורים קודם פסח	פורים קודם פסח
22	18	1	398.86	238.14	160.72	88	dc1	whole	14	ביארנו	ביארנו לעיל (ענף ב') שעמלק עשה פגם בהגילוי של ה' אחד שנתגלה ביציאת מצרים, וע״י מחיית עמלק חוזר ומתגלה הגילוי של ה' אחד של יציאת מצרים, ובזה מובן למה יו״ט פורים הוא ל' יום קודם פסח והוא ההכנה ליו״ט פסח, כי ע״י פורים ומחיית עמלק חוזר המדריגה של יציאת מצרים, ועוד איתא בספה״ק כי מחיית עמלק יהי' במשך הל' יום מפורים עד פסח, והביאור הוא כמו שכתבנו שזהו ההכנה שיחזור הגילוי של ה' אחד.
22	18	1	148.47	23.81	124.66	89	subhead	whole	1	מרדכי גזר תענית על פסח	מרדכי גזר תענית על פסח
22	18	1	117.85	34.02	83.83	90	dc1	head	2	ויותר	ויותר מזה מצינו בחז״ל, שמרדכי צוה להתענות על פסח
22	18	2	429.48	68.04	361.44	90	body	tail	4	ולבטל ליל הסדר, ולפי הנ״ל יתבאר	ולבטל ליל הסדר, ולפי הנ״ל יתבאר היטב כי כשנתעורר המן ועמלק אזי יש ביטול להגילוי של ליל הסדר ולכן התבטל ליל הסדר.
22	18	2	337.28	23.81	313.47	91	subhead	whole	1	מספר ד' ביו״ט פסח וליל הסדר	מספר ד' ביו״ט פסח וליל הסדר
22	18	2	306.66	153.09	153.57	92	dc1	whole	9	ובאמת	ובאמת מצינו שיש הרבה דברים ביו״ט פסח שמספרים ד', א'-ד' כוסות, ב'-ד' בנים, ג'-ד' קשיות ד'-ד' פסוקים שדורשין ההגדה, ה'- לוקחין השה בי' ניסן לבודקו ד' ימים ו'- גם המצות שבעצם יש ג' מצות קודם ההגדה עושים יחץ ונשבר לשנים ועי״ז יש גם ד' מצות.
22	18	2	134.86	51.03	83.83	93	dc1	whole	3	והוא	והוא מרמז לתיקון הקוץ של הד' רבתי מה' אחד שהתגלה בליל הפסח.
23	19	1	516.0	23.81	492.19	94	subhead	whole	1	תכלית סיפור יציאת מצרים	תכלית סיפור יציאת מצרים
23	19	1	485.38	153.09	332.29	95	dc1	whole	9	ולכן	ולכן מצינו בההגדה שהתנאים היו מסובין בבני ברק ועוסקין בההגדה עד שבאו תלמידיהם ואמרו רבותינו הגיע זמן קרי״ש של שחרית, וביארו בספה״ק שהוא בא לרמז שתכלית ההגדה הוא עד שיגיע לקרי״ש הבחי' של הד' של ה' אחד שנתגלה ביציאת מצרים.
23	19	1	322.77	23.81	298.95	96	subhead	whole	1	הפסח נאכל רק צלי	הפסח נאכל רק צלי
23	19	1	292.15	34.02	258.13	97	dc1	head	2	ובזה	ובזה יש לבאר מה שהפסח שאני מכל הקרבנות שיש בו דין
23	19	2	511.58	119.07	392.51	97	body	tail	7	שאינו נאכל אלא צלי באש,	שאינו נאכל אלא צלי באש, משום דג' אותיות אלו צ,ל,י, הם אותיות היחידות מכל הא'ב' שיש בהם ד' בנסתר, צדיק למד יוד, ומרמז שהפסח ״יצלה״ כולו לגלות ה' אחד הנסתר בתוך הבריאה.
23	19	2	360.19	102.06	258.13	98	dc1	whole	6	איתא	איתא בחז״ל כל המאריך בד' דאחד מאריכין לו ימיו ושנותיו, יעזור השי״ת שנזכה לחיים ארוכים בגילוי ה' אחד, ע״י משיח בן דו״ד, שמרמז לגילוי של של ד' וד' של דרדר בב״א.
