page	display_pg	col	y_top	height	y_bot	el_idx	kind	frag	n_lines	text	rendered_text
5	1	0	470.46	51.92	418.54	0	sefer_title	full	1	מחיית עמלק - תיקון ל'וקוץ ודרדר תצמיח לך'	מחיית עמלק - תיקון ל'וקוץ ודרדר תצמיח לך'
5	1	0	374.39	44.0	330.39	1	anaf	full	1	ענף א' קליפת עמלק בחטא עץ הדעת	ענף א' קליפת עמלק בחטא עץ הדעת
5	1	1	322.73	56.81	265.92	2	subhead	whole	1	עמלק גרם חטא הראשון של עץ הדעת	עמלק גרם חטא הראשון של עץ הדעת
5	1	1	259.11	204.12	54.99	3	dc1	whole	12	הנה	הנה עמלק הוא בחי' ראשית הקיקול והקליפה כמו שנאמר ״ראשית גוים עמלק״, ובוודאי הוא בחי' הנחש שגרם חטא הראשון של חטא עץ הדעת שהוא שורש כל החטאים שבא מכח הקילקול של חטא עץ הדעת, וכן מרומז בהא שדרשו חז״ל שהמקור להמן שהי' נכדו והמשך של עמלק מרומז החטא עץ הדעת שנא' ״המן״ העץ, ומבואר שעמלק הוא שגרם חטא עץ הדעת.
5	1	2	322.73	56.81	265.92	4	subhead	whole	1	ביאור קללת קוץ ודרדר תצמיח לך	ביאור קללת קוץ ודרדר תצמיח לך
5	1	2	259.11	204.12	54.99	5	dc1	whole	12	וא'	וא' מהקללות שנגרם על ידי חטא עץ הדעת הוא מה שנא' ״קוץ ודרדר תצמיח לך״, וביארו בספה״ק עומק קללה זו דיש ד' רבתי בתיבת אחד בהפס' של שמע ישרא' ה' אלקינו ה' אחד וזה לעומת זה יש ר' רבתי בתיבת אחר של הפס' לא תשתחוה לאל אחר, כדי שתהא ברור ולא תהא מקום לטעות בין ה' אחד לאל אחר. ועל ידי חטא עץ הדעת הי' קילקול ונתערב טוב ברע וע״י זה יש מקום לטעות בין הד' של ה' אחד לר' של אל אחר, והוא בחי'
6	2	1	530.0	102.06	427.94	5	body	whole	6	הקללה של קוץ ודרדר תצמיח לך	הקללה של קוץ ודרדר תצמיח לך כי החילוק של ד' ור' בין בצורת האות ובין בהגימטריא הוא קו״ץ (ר - קו״ץ = ד׳, 200 - 196 = 4), וזהו מרומז בקוץ ודרדר תצמיח לך שהתערב ונפגם הד' עם הר' ע״י נטילת הקוץ.
6	2	1	409.83	73.06	336.77	6	subhead	whole	1	תוספות ביאור החילוק בין ד' לר' שורות ישרות או עקומות	תוספות ביאור החילוק בין ד' לר' שורות ישרות או עקומות
6	2	1	329.96	272.16	57.8	7	dc1	head	16	ויש	ויש להוסיף עוד ביאור כי השי״ת הוא בחי' ישר כמו שנא' להגיד כי ישר ה', וכן כתי' טוב וישר ה', 'וכן התורה הק' נקרא ישר כמו שנא' פיקודי ה' ישרים, משא״כ הרע והקליפה הוא להיפוך עקום ועקלתון, והפגם של דרדר הוא שנפגם ד' הישר של ה' אחד לר' עקומה של אל אחר, וי״ל שהתיקון של הר' שנתהוה ע״י חטא עץ הדעת הוא לסדר האותיות. להפך מהמילוי של אות ריש לישר כי החילוק בין צורת אות ר' לצורת אות ד' שהאות ריש הוא שורות עקומות משא״כ האות ד' הוא שורות ישרות כי הד' שמרמז על השי״ת הוא בחי' ישר משא״כ הר' שמרומז על הרע הוא
6	2	2	530.0	34.02	495.98	7	body	tail	2	עקומה וע״י שנעשה מריש ישר נעשה	עקומה וע״י שנעשה מריש ישר נעשה תיקון של ד' שהוא שורות ישרות.
6	2	2	485.09	56.81	428.28	8	subhead	whole	1	מלחמת עמלק על ישראל	מלחמת עמלק על ישראל
6	2	2	421.48	238.14	183.34	9	dc1	whole	14	ולכן	ולכן ישרא' שהם מאמינים בה' אחד נקראים גוי אחד הבחי' של הד' רבתי של ה' אחד, וכמו דאמרינן בתפילה ואל יאבד גוי אחד, המיחדים שמך ה' אלקנו ה' אחד, ונקראים ישרים, ישראל מל' ישר-אל, וכמו שנא' תומת ישרים תנחם וכלל״י הם הבחי' של והאלקים עשה את האדם ישר משא״כ עמלק הוא בחי' ר' רבתי של אל אחר המתנגד לה' אחד ולכן עמל״ק בגי' א״ל אח״ר וכן ״עמלק״ הוא אותיות ״מעקל״ שהוא בחי' נחש עקלתון, ולכן עמלק מתנגד נגד ישרא' לבטל בחי' ה' אחד.
6	2	2	172.45	56.81	115.64	10	subhead	whole	1	ביאור קללת על גחונך תלך	ביאור קללת על גחונך תלך
6	2	2	108.83	51.03	57.8	11	dc1	whole	3	ולפי	ולפי זה יבואר היטב מה שנענש הנחש שהוא בחי' עמלק שיהיו "על גחונך תלך״ שהרי עי״ז כל גופו נעשה
7	3	1	530.0	34.02	495.98	11	body	whole	2	עקומה לבחי' של נחש עקלתון צורה	עקומה לבחי' של נחש עקלתון צורה של ר' שאינה שורות ישרות.
7	3	1	466.12	56.81	409.31	12	subhead	whole	1	עמלק בחי' הזבוב שעושה מד' ר'	עמלק בחי' הזבוב שעושה מד' ר'
7	3	1	402.5	340.2	62.3	13	dc1	whole	20	ומקור	ומקור לדבר זה שעמלק הוא בחי' חטא עץ הדעת שפגם באות ד' לעשותו ר', מבואר בספר עטרת ישועה (פ' - בשלח), הנה הגמ' סוטה כ' אמר רב יהודה אמר שמוא' משום ר' מאיר כשהייתי למד תורה אצל ר' עקיבא הייתי מטיל קנקנתום לתוך הדיו, ומבאר הגמ' שהיתה מיחש לזבוב דילמא יתיב אתגי' (הקוץ) של דלי״ת ומחוק לי' ומשוי לי' רי״ש ולכן הטיל קנקנתום שלא יוכל להימחק, ופי' רש״י כגון ד' דאחד דהיינו שיעשה מאחד אחר, ומבאר העטרת ישועה שהזבוב מרמז על עמלק כמבואר בבעל הטורים פ' בשלח שזבו״ב ר״ת ו'שים ז'את ז'כרון ב'ספר ועמלק הוא בחי' הזבוב שרוצה למחוק הקוץ של הד' לעשותו ר' בבחי' קוץ ודרדר, ומבואר שעמלק הוא הפוגם בקוץ ודרדר תצמיח לך בחטא עץ הדעת.
7	3	2	530.0	73.06	456.94	14	subhead	whole	1	ספר תורה של ר״מ במדריגה קודם חטא עץ הדעת	ספר תורה של ר״מ במדריגה קודם חטא עץ הדעת
7	3	2	450.13	119.07	331.06	15	dc1	whole	7	וע״ש	וע״ש בעטרת ישועה שהוסיף עוד, דהי' ספר תורה של ר' מאיר, ור' מאיר הי' תלמוד של אחר, ואחר הוא בחי' ר' רבתי של אל אחר, אבל כחו של ר' מאיר הי' שתוכו אכל וקליפתו זרק ותיקון שתורתו יהי' במדריגת ד' רבתי ולעשות מר' ד' כנ״ל עכת״ד ע״ש.
7	3	2	324.26	170.1	154.16	16	dc1	whole	10	ויש	ויש להוסיף דבאמת מצינו עוד דבר מיוחד בתורתו של ר' מאיר שהי' כתי' שם כתנות אור עם א'. תחת ע' של עור וביארו בספה״ק שהי' במדריגה של תיקון קודם חטא עץ הדעת שלא היצטרכו כתנות עור עם ע' וממש נפלא שדוקא בתורתו הקפיד ג״כ שיהי' תיקון לאות ד' שח״ו לא ימחה להיות ר' בדרגת התיקון על הקוץ ודרדר תצמיח לך.
7	3	2	147.35	85.05	62.3	17	dc1	whole	5	ונמצא	ונמצא שספר תורה שלו הי' מיוחד באות א' של אור וגם מיוחד בד' שלא יהי' ר' והוא אותיות אדר ונגד ערד מלך עמלק שהוא בחי' ע' והר' קודם הד' וחודש אדר קיבלו התורה
8	4	1	530.0	51.03	478.97	17	body	head	3	מאהבה בפורים, והי' במדריגה של	מאהבה בפורים, והי' במדריגה של תורה הק' כתיקונם והוא בחי' מחיית עמלק של אדר ופורים ולכן כתי'
8	4	2	530.0	51.03	478.97	17	body	tail	3	ליהודים היתה אורה ודרשו חז״ל	ליהודים היתה אורה ודרשו חז״ל אורה זו תורה שהיתה תורה בבחי' אור וכמו שנבאר לקמן ב״ה.
9	5	0	502.0	44.0	458.0	18	anaf	full	1	ענף ב' מלחמת עמלק בקריעת ים סוף לבטל קבלת התורה	ענף ב' מלחמת עמלק בקריעת ים סוף לבטל קבלת התורה
9	5	1	450.35	56.81	393.53	19	subhead	whole	1	האבות במדריגה ישרים	האבות במדריגה ישרים
9	5	1	386.73	306.18	80.55	20	dc1	whole	18	והנה	והנה עמלק גרם לעוות היושר והאמונה בה' אחד וגרם קלקול בכל העולם בבחי' קוץ ודרדר תצמיח לך וכמו שביארנו לעיל, אבל האבות הם היו בבחי' תיקון העולם, וגילוי אמונת ה' בעולם ורק התולדות של האבות בני יעקב אבינו הוצטרכו לילך ולהזדכך בכור הברזל של גלות מצרים ולתקן חטא אדם הראשון עד שיזכו לתעבדון את האלקים על ההר הזה בבחי' פסקה זוהמתן של הנחש בחטא עץ הדעת, ולכן ספר בראשי״ת שהוא בחי' ספר האבות הוא האותיות יש״ר אב״ת שהאבות היו בבחי' ישרים (וספר בראשית נקרא ספר הישר) שהאבות גילוי בחי' ה' אחד בחי' ישר מריש כמבואר לעיל.
9	5	2	450.35	73.06	377.28	21	subhead	whole	1	מעלת יציאת מצרים וקריעת ים סוף לגלות ד' רבתי של ה' אחד	מעלת יציאת מצרים וקריעת ים סוף לגלות ד' רבתי של ה' אחד
9	5	2	370.48	221.13	149.35	22	dc1	whole	13	אבל	אבל זה הי' רק מדריגת האבות אבל כלל ישרא' הלכו במצרים להזדכך עד שיגיעו למתן תורה ולכן בהתחלת גלות מצרים כתי' ויקצו מפני בני ישרא' דהיינו שהמצרים רצו להפסיד בחי' תיקון הקוץ של ה' אחד הקוץ ודרדר תמציח לך ולאחר כל השיעבוד והעשר מכות ויציאת מצרים כתי' ובני ישרא' יוצאים ביד רמה ופי' התרגום בריש גלי וי״ל הפי' שנתגלה האפסיות והשקר של הריש האות ר' רבתי של אל אחר ונשתנה לישר ושורות ישרות של ד' לגילוי ה' אחד.
9	5	2	131.58	51.03	80.55	23	dc1	whole	3	וביותר	וביותר נתגלה דבר זה בשעת קריעת ים סוף שהרי אז כבר נאמר ויאמינו בה' ובמשה עבדו, שזכו להאמין
10	6	1	530.0	85.05	444.95	23	body	whole	5	ולגלות הד' רבתי של ה' אחד	ולגלות הד' רבתי של ה' אחד ולכן הסוף של שירת הים שהוא בחי' התכלית הוא אות ד' של ה' ימלוך לעולם ועד שנתגלה בחי' ד' רבתי של ה' אחד ונתגלה מלכות ה' בכל העולם.
10	6	1	438.15	238.14	200.01	24	dc1	whole	14	וכן	וכן יש נוהגין בתפילת שחרית לאחר שירת הים לומר ובתורתך כתוב לאמר שמע ישרא' ה' אלקנו ה' אחד כי בשעת קריעת ים סוף נתגלה הד' רבתי כנ״ל, וגם אומרים הפס' של והיה ה' למלך וגו', ה' אחד ושמו אחד ועוד י״ל שלכן מתחיל השירה באז ישיר, ישי״ר הוא בחי' ישר שנעשה מריש יש״ר שיהי' שורות שוות כמו ד' וכן א״ז בגי' ב' פעמים ״ד' בחי' דרדר, וביותר מרומז בהא די״ם סו״ף בגי' קו״ץ, וקריעת ים סוף היינו שנקרע מספר י״ם סו״ף קו״ץ מר' שהוא מספר ד' שנתגלה הד' של ה' אחד.
10	6	1	189.12	73.06	116.06	25	subhead	whole	1	עמלק בא לבטל גילוי ה' אחד של קריעת ים סוף	עמלק בא לבטל גילוי ה' אחד של קריעת ים סוף
10	6	1	109.25	51.03	58.22	26	dc1	head	3	ולפי	ולפי המבואר לעיל מובן למה דוקא כאן בא עמלק להילחם עם ישרא' כי עמל״ק שהוא בגי' א״ל אח״ר
10	6	2	530.0	68.04	461.96	26	body	tail	4	בחי' ר' רבתי אינו יכול לסבול	בחי' ר' רבתי אינו יכול לסבול הגילוי של הישרות של ה' אחד שנתגלה בקריעת י״ם סו״ף שהוא בחי' הקו״ץ של הד' כמו שנתבאר לעיל.
10	6	2	451.75	68.04	383.71	27	dc1	whole	4	ובזה	ובזה ימתק מה שנא' בעמלק מלחמה לה' בעמלק מדרד״ר שהם אותיות דרדר לתקן מה שהחליש וקרר הגילוי של ה' אחד.
10	6	2	373.51	68.04	305.47	28	dc1	whole	4	ועוד	ועוד יובן מה שאיתא במדרש שעמלק בא מהלך של ת' פרסה וי״ל שמרומז בת' שהוא בגי' קו״ץ ד״ר שבא להילחם בתיקון הקו״ץ של ה' אחד.
10	6	2	291.18	73.06	218.12	29	subhead	whole	1	מלחמת עמלק פגם בקבלת התורה של נעשה ונשמע	מלחמת עמלק פגם בקבלת התורה של נעשה ונשמע
10	6	2	211.31	153.09	58.22	30	dc1	whole	9	וביותר	וביותר עומק י״ל כי ע״י הגילוי של קריעת ים סוף זכו לקבלת התורה בשלימות ולמדריגת נעשה ונשמע, כי התורה הוא בחי' של פיקודי ה' ישרים משמחי לב, וכן כתי' ישרים דרכי ה' צדיקים ילכו בם וע״י התיקון של ישר ותיקון של ה' אחד של קריעת ים סוף זכו לקבלת התורה, וכן מדריגת נעשה ונשמע הוא מדריגת ישרים
11	7	1	530.0	170.1	359.9	30	body	whole	10	כמבואר במסכת שבת פ״ח במעשה	כמבואר במסכת שבת פ״ח במעשה דהדדוקי שאמר לרבא שכלל ישרא' הם עמא פזיזא שקיבלו נעשה קודם לנשמע וא״ל שאצל כלל ישרא' כתי' תומת ישרים תנחם ע״ש, ואז הי' זמן של תיקון חטא עץ הדעת כי המדריגה של ישרים מחייב קבלת התורה מאהבה ושמחה כי הוא מדריגה של ישרים, משמחי לב ומקבל התורה בשלימות.
11	7	1	354.8	85.05	269.75	31	dc1	whole	5	ועמלק	ועמלק רצה לבטל מדריגת הישר ולכן בא לאחר קריעת ים סוף לבטל מדריגת הישר של כלל ישרא' ולבטל מדריגה נעשה ונשמע שבא מכח מדריגת ישרים.
11	7	1	264.64	85.05	179.59	32	dc1	whole	5	ויש	ויש לומר רמז נפלא שלכן כתי' זכור את אשר עשה לך עמלק בדרך עש״ה ל״ך בגי' נעש״ה עמל״ק בדר"ך בג' ונשמ״ע. שעמלק בא לבטל מדריגה זו של כלל ישרא' שבא מכח מדת הישר.
11	7	1	170.41	56.81	113.59	33	subhead	whole	1	עמלק גרם חטא העגל	עמלק גרם חטא העגל
11	7	1	106.79	34.02	72.77	34	dc1	head	2	ואע״פ	ואע״פ שכלל ישרא' קיבלו התורה בנעשה ונשמע מלחמת עמלק
11	7	2	530.0	204.12	325.88	34	body	tail	12	גרם שלא יהי' בשלימות וע״י זה	גרם שלא יהי' בשלימות וע״י זה נגרם חטא העגל שהוא בחי' א״ל אח״ר שבגימטריא עמל״ק, וכן עמל״ק שבא ביום המ' ליציאת מצרים הוא אותיות עגל מ' כי אות ק' ואות ג' מתחלפין, ולכן כתי' לך רד כי שחת עמך כי על ידי חטא העגל חזרה זוהמת הנחש ונשאר הבילבול של קוץ ודרדר תצמיח לך, וכל זה ע״י מלחמת עמלק בין קריעת ים סוף למתן תורה שהוא מנגד לתיקון של ה' אחד.
11	7	2	289.48	56.81	232.66	35	subhead	whole	1	משה רבינו לא משתייך לחטא העגל	משה רבינו לא משתייך לחטא העגל
11	7	2	225.86	153.09	72.77	36	dc1	whole	9	ואע״פ	ואע״פ שלכלל ישרא' הי' פגם של חטא העגל בחי' ר' של אל אחר משה רבינו לא נפגם כלל בחטא העגל כמו שביארו בספה״ק הא דנתגלה טעמו של פרה אדומה רק למשה רבינו שהרי הפרה אדומה הי' משתייך לכפרת חטא העגל ורק משה רבינו שלא הי' בכלל בעולם הזה בשעת החטא ולא הי' משתייך לזה כלל זכה
12	8	1	530.0	136.08	393.92	36	body	whole	8	להשיג טעם הפרה אדומה, ולכן משה	להשיג טעם הפרה אדומה, ולכן משה רבינו הוא בחי' התיקון של ד' רבתי משא״כ כלל ישרא' שנפגמו קצת בחטא העגל ולכן החילוק של הגימטריא בין מש״ה לישרא״ל הוא כמנין קו״ץ (י״ם סו״ף) שמשה רבינו זכה שישאר אצלו אותו גילוי של ה' אחד של קריעת ים סוף ומתן תורה.
12	8	1	387.12	170.1	217.02	37	dc1	whole	10	וגם	וגם כתי' במשה רבינו שקרן עור פניו והוא בחי' כתנות אור עם א' של תיקון חטא עץ הדעת וכלל״י אבדו מדריגה זו בחטא העגל אבל משה זכה שישאר אצלו וכתי' ויתן על פניו מסוה הוא הס״ת של סוס ורוכבו רמה בים שהיא עיקר השירה שנאמרה בתורה בין באנשים בין בנשים, שהסתיר המדריגה של תיקון חטא עץ הדעת שזכו בשעת קריעת ים סוף ומתן תורה.
12	8	1	206.13	56.81	149.32	38	subhead	whole	1	מחיית עמלק ע״י אמן יהא שמי' רבא	מחיית עמלק ע״י אמן יהא שמי' רבא
12	8	1	142.51	85.05	57.46	39	dc1	head	5	ויש	ויש להוסיף עוד, שהרי אמרו חז״ל אין השם שלם וכסא שלם עד שימחה זרעו של עמלק, ולכן מתפללין בקדיש יהא שמי' רבא שיגדל שמו של הקב״ה במחיית עמלק, ואז יהי' תיקון של ה'
12	8	2	530.0	51.03	478.97	39	body	tail	3	אחד ושורות ישרות של ד' ולכן	אחד ושורות ישרות של ד' ולכן הר״ת של יהא שמי' רבא הוא ישר שבמחיית עמלק יהיו במדריגת ישרים.
12	8	2	467.91	56.81	411.1	40	subhead	whole	1	ערד מלך עמלק	ערד מלך עמלק
12	8	2	404.3	221.13	183.17	41	dc1	whole	13	ובאמת	ובאמת מצינו עוד פעם שבא עמלק להילחם עם ישרא' בתורה בפ' חקת וישמע הכנעני מלך ערד יושב הנגב וגו'. ופירש״י ששמע שמת אהרן, וי״ל שערד יש בו אותיות ר״ד שבא להמשיך קליפת עמלק לבטל הקוץ של ה' אחד לאל אחר וער״ד בגי' מרדכ״י וכמו שנבאר לקמן (ענף ד') שמרדכי הוא בחי' התיקון של הד' נגד קליפת ערד וחודש אדר הוא כנגד ערד כי ע' וא' מתחלפין ויש באדר ג״כ התיקון של ר' ד' כמו שיתבאר לקמן (ענף ה'), וגם כתי' וידר נדר מל' תיקון של ד' ר'.
12	8	2	172.11	56.81	115.3	42	subhead	whole	1	נחש הנחושת	נחש הנחושת
12	8	2	108.49	51.03	57.46	43	dc1	whole	3	ומיד	ומיד לאחר שבא ערד מלך עמלק כתי' וידבר העם באלקים ובמשה והתלוננו על המן ובא נחשים ושרפים,
13	9	1	530.0	102.06	427.94	43	body	head	6	ולפי הנ״ל י״ל שערד מלך עמלק	ולפי הנ״ל י״ל שערד מלך עמלק עשה פגם במדריגה של קבלת התורה שהרי לא ניתנה תורה אלא לאוכלי המן, וכמו שביארנו לעיל שעמלק מבטל הקבלת התורה בדרגה של ישרים ולכן בא עונש
13	9	2	530.0	102.06	427.94	43	body	tail	6	של נחש שהי' בחי' חטא עץ	של נחש שהי' בחי' חטא עץ הדעת שגם כן הי' פגם בבחי' ד' הישר, ולכן אמר לו השי״ת למשה עשה לך שרף, ושים אותו על הנס שהוא בח' עץ ישר, לעשות מנחש העקלתון ר' עקומה בחי' ישר של ד'.
14	10	0	502.0	44.0	458.0	44	anaf	full	1	ענף ג' מלחמת עמלק בימי שמוא' ושאול ואגג	ענף ג' מלחמת עמלק בימי שמוא' ושאול ואגג
14	10	1	450.35	255.15	195.2	45	dc1	whole	15	והנה	והנה מלחמת עמלק נמשך בכל הדורות ובזמן שאול המלך היתה עוד התעוררות למחיית עמלק והוא ההפטורה לשבת זכור, ולבסוף כתי' שם ״וישסף שמוא' את אגג לפני ה'״ שהרג שמוא' המלך של עמלק בזמן ההוא, אבל לא כתי' שהרגו סתם רק כתי' וישסף ופירש רש״י וישסף - ״חתכו לארבע״, ואין לתיבה זו דמיון, וצ״ב למה הורגו דוקא במיתה זו שחתכו לד' חלקים, ועוד צ״ב מהו המקור לרש״י שזהו הפי' של וישסף [ובפשטות מביא שם רש״י מהתרגום שהוא ל' בקיעה ורש״י הבין שהבקיעה של אדם הוא ע״י שיחתכו לארבע חלקים].
14	10	2	450.35	255.15	195.2	46	dc1	whole	15	אבל	אבל לפי מה שביארנו לעיל שהקליפה של עמלק הוא להכחיש הד' רבתי של ה' אחד של שורות ישרות ולעורר הר' רבתי של אל אחר מובן היטיב למה המחיית עמלק של שמוא' הי' דוקא שיעשה מאגג ד' חלקים שרצה לתקן הד' רבתי של ה' אחד וי״ל רמז נפלא שמרומז כן בהפס' דכתי' וישסף שמוא' א״ת אג״ג לפנ״י ה״י, א״ת אג״ג בגמטריא דרד״ר, לפנ״י הי' בגימטריא קו״ץ כלומר שעל ידי שחותכו לד' רצה לתקן הקוץ ודרדר שיהי' ד' רבתי של ה' אחד (וגם חתכ״ו בגי' דל״ת חתכ״ו לד' היינו ב' פעמים ד' של דרדר).
15	11	0	502.0	44.0	458.0	47	anaf	full	1	ענף ד' מלחמת עמלק בימי מרדכי ואסתר והמן	ענף ד' מלחמת עמלק בימי מרדכי ואסתר והמן
15	11	1	450.35	56.81	393.53	48	subhead	whole	1	המן מתנגד לתיקון הקוץ של הד'	המן מתנגד לתיקון הקוץ של הד'
15	11	1	386.73	306.18	80.55	49	dc1	head	18	ובימי	ובימי אחשורוש הי' עוד זמן שהתעורר קליפת עמלק על ידי המן, והמן הי' בחי' של עבודה זרה, הר' רבתי של ״אל אחר״ שבגי' עמל״ק כמבואר לעיל, ולכן כל אחד ואחד הי' צריך להשתחוות להמן, בבחי' לא תשתחווה לאל אחר, [וגם הקיטרוג של אותו דור היתה שהשתחוו לצלם] והמן לא הי' סובל הד' רבתי של ה' אחד ולכן התנגד לישנו עם אחד היינו כלל ישרא' שמכריזים הד' רבתי של ה' אחד, ועוד איתא במדרש על והנה המן עומד בחצר שבא דוקא בזמן שאין אומרים קרי״ש (באמצע הלילה). והמ״ן במילוי כזה ה״ה מ״ם נו״ן בגימטריא קו״ץ שהתנגד לתיקון של הקו״ץ ודרדר תצמיח לך ובאמת מצינו בחז״ל שהעץ שעליו נתלה המן הי' ״קוץ״, עיין מדרש רבה
15	11	2	450.35	136.08	314.27	49	body	tail	8	('(ט״ב)', 'frankrealmed', 11.475) אמרו חכמים בשעה שבא להכינו	(ט״ב) אמרו חכמים בשעה שבא להכינו קרא הקב״ה לכל עצי בראשית מי יתן עצמו ויתלה רשע זה עליו ע״ש שבא כל מיני עצים עד שבא קוץ וכו', שאני קוץ והוא קוץ מכאיב, ונאה שיתלה קוץ על קוץ. ולפי דברינו מובן היטב שזה הי' קליפת המן ועמלק ועליו נתלה לגלות ולתקן הד' רבתי של ה' אחד.
15	11	2	297.26	56.81	240.44	50	subhead	whole	1	המן מתנגד להגילוי של קריעת ים סוף	המן מתנגד להגילוי של קריעת ים סוף
15	11	2	233.64	153.09	80.55	51	dc1	whole	9	ועוד	ועוד יש לרמז דהמן מתנגד לגילוי של קריעת ים סוף דכתי' אמר אויב ארדף אשיג אחלל שלל, אויב מרמז להמן דכתי' איש צר ואויב, אחלק שלל, הוא נגד מה שכתוב בתורה, בנימין זאב יטרוף בבוקר יאכל עד ולערב יחלק שלל ופירש״י דקאי על זמן מרדכי והמן שנטל מרדכי ביתו של המן, ועוד י״ל רמז נפלא, דיש נ״ד פעמים המ״ן
16	12	1	530.0	119.07	410.93	51	body	whole	7	במגילה והוא בגי' חמשת אלפים ק״ל	במגילה והוא בגי' חמשת אלפים ק״ל והוא מרומז באחל״ק שהוא ר״ת חמשת אלפים ק"ל ובחי' השלל מרמז על הגילוי של ה' אחד, שכן אוי״ב ארד״ף אשי״ג אחל״ק של״ל בגי' שמ״ע ישרא' ה' אלקנו ה' אח״ד (ועם אמ״ר אויב בגי' ברו״ך ש״ם כבו״ד מלכות״ו לעול״ם וע״ד).
